{
  "schema": "flowmemory.agent_bonds_runtime_evidence_attestation.v1",
  "multiOperatorRunCompleted": false,
  "evidencePath": "docs/reviews/AGENT_BONDS_MULTI_OPERATOR_RUNTIME_EVIDENCE.md",
  "docPath": "docs/OPERATIONS/AGENT_BONDS_MONITORING_AND_RECOVERY.md",
  "completedAt": "PENDING",
  "notes": "Replace after a real multi-operator runtime rehearsal or live capped pilot run."
}
